Retail Banking and Wealth Management Summer Internship,HSBC,17/04/2019,Summer Internship,Competitive,Nationwide,"We are looking for dedicated and courageous students - from all backgrounds and degree disciplines - to join our Summer Internships and ultimately our global Graduate Programme. At HSBC we are open to different ideas and cultures, connected to our customers, communities and each other, and dependable, we do the right thing. These are the values that guide us every day. We seek to recruit people who share these values and will help us to sustain them.",Finance,0,Paid,https://www.ratemyplacement.co.uk/jobs/16733/hsbc/retail-banking-and-wealth-management-summer-internship
Business and Finance Industrial Placement,Collins Aerospace,16/02/2019,Placement Year,Competitive,Widnes,"Collins Aerospace is a global leader in aerospace and defence. There are few – if any – aircraft around which don’t have our equipment in them somewhere. Delavan Limited are world class at design and manufacture of Industrial spray nozzles.

You will get to work in a finance department supporting a business of 49 employees and dealing with both Industrial and Aerospace accounting. For someone who’s bright, switched on and willing to learn, it’s the best possible place to begin a career within the Finance function.",Finance,253,Paid,https://www.ratemyplacement.co.uk/jobs/17827/collins-aerospace/business-and-finance-industrial-placement
Credit Analyst Placement,Tech Data,15/02/2019,Placement Year,"15,000",Basingstoke,"We're currently looking for a Credit Analyst to join our thriving Finance team for a 1 year placement at Tech Data.

Job Purpose:
Responsible for reviewing and assessing the creditworthiness of new and existing accounts in line with our credit and insurance policies.
Monitoring and communicating changes in regard to the creditworthiness of our customers.
Ensuring our customer base is maintained and accurate
Provide high levels of customer satisfaction to new and existing customers.",Finance,52,Paid,https://www.ratemyplacement.co.uk/jobs/17641/tech-data/credit-analyst-placement